{
  "$schema": "../schemas/fates-lock.schema.json",
  "_note": "Immutable historical snapshot of the fates-slice-002-2026-08-09 compatibility set. Slice 02 is sealed at the slice level; the global compatibility set remains provisional because the unchanged Moirae baseline is pushed_untagged. Do not modify except to correct verified recording errors.",
  "schemaVersion": "1.0.0",
  "compatibilitySetId": "fates-slice-002-2026-08-09",
  "snapshotPath": "compatibility-sets/fates-slice-002-2026-08-09.json",
  "previousCompatibilitySet": "fates-stage-a-2026-07",
  "updatedAt": "2026-08-09T21:02:20.231Z",
  "sealStatus": "provisional",
  "integrationLevel": "runtime_validated",
  "protocol": {
    "current": "1.4.0",
    "minimum": "1.0.0",
    "maximum": "1.4.0"
  },
  "repositories": {
    "adrasteia": {
      "url": "https://github.com/hourwise/Project-Adrasteia",
      "tag": "adrasteia-adoption-v0.4.0-protocol-1.4.0",
      "commit": "124b6aee2629a3147739934ad5f1b45b32c8ba46",
      "checkpointState": "sealed_tagged",
      "package": "project-runtime-contracts@0.4.0",
      "artifact": {
        "url": "https://github.com/hourwise/Project-Adrasteia/releases/download/adrasteia-adoption-v0.4.0-protocol-1.4.0/project-runtime-contracts-0.4.0.tgz",
        "sha256": "11ee062b079f74d2a4558af315c9b9b12a6aede291d409c48f038d93c416e2c2"
      },
      "role": "portable-representation"
    },
    "ananke": {
      "url": "https://github.com/hourwise/Project-Ananke",
      "tag": "ananke-fates-slice-002-v0.2.0-protocol-1.4.0",
      "commit": "52b512885edf3fec7ff7ce4b4dcbd3958b170ba4",
      "checkpointState": "sealed_tagged",
      "role": "action-authority"
    },
    "mnemosyne": {
      "url": "https://github.com/hourwise/Project-Mnemosyne",
      "tag": "mnemosyne-adrasteia-adoption-v0.1.0-protocol-1.4.0",
      "commit": "f4ab76a9760f856d78908d35facceb068d78c8e5",
      "checkpointState": "sealed_tagged",
      "role": "memory-provenance"
    },
    "horae": {
      "url": "https://github.com/hourwise/Project-Horae",
      "tag": "horae-fates-slice-002-v0.1.0-protocol-1.4.0",
      "commit": "9566eb2764339d6a6fe143c1630eeb009e00a7bd",
      "checkpointState": "sealed_tagged",
      "role": "discovery-composition and Slice 02 handoff/relay"
    },
    "moirae-code": {
      "url": "https://github.com/hourwise/Project-Moirae-Code",
      "tag": null,
      "commit": "a4783db271a61848c66ac4f6652a539bdb515e28",
      "checkpointState": "pushed_untagged",
      "role": "governed-host; unchanged provisional baseline"
    }
  },
  "notes": "FATES-SLICE-002 is formally accepted and sealed at the slice level against the tagged Ananke and Horae implementation checkpoints, live acceptance evidence, and final validations. The live record explicitly distinguishes live verified, owner-local deterministic, and not-live-induced behavior. The global compatibility set remains provisional solely because the unchanged locked Moirae Code baseline is pushed_untagged.",
  "knownLimits": [
    "Moirae Code was not modified or started for Slice 02 and remains pushed_untagged",
    "Mnemosyne was independently started and inspected but is explicitly excluded from the Slice 02 handoff path",
    "Live timeout, post-dispatch indeterminate transport loss, and missing/wrong producer or capability induction were not performed",
    "No qualified memory handoff, durable idempotency/recovery, content preflight, or global host governance is claimed"
  ]
}
